{
  "case_id": "college_delta_structured_registry",
  "scenario": "Рособрнадзор + колледж + structured registry package",
  "regulator": "Рособрнадзор",
  "organization_type": "educational",
  "report_type": "readiness_report",
  "status": "benchmark_ready",
  "redaction_level": "redacted_real_like",
  "difficulty": "medium",
  "tags": ["pilot", "structured", "registry", "metrics"],
  "analysis_focus": ["structured_evidence", "registry_rows", "status_accuracy"],
  "quality_targets": {
    "requirement_f1_min": 0.95,
    "status_accuracy_min": 0.75,
    "evidence_f1_min": 0.60,
    "section_coverage_min": 0.85
  },
  "documents": [
    {
      "path": "samples/real_corpus/cases/college_delta_structured_registry/documents/normative_structured_excerpt.txt",
      "category": "normative",
      "source_type": "regulatory_excerpt",
      "description": "Нормативный фрагмент с упором на structured evidence и registry rows."
    },
    {
      "path": "samples/real_corpus/cases/college_delta_structured_registry/documents/site_registry_snapshot.txt",
      "category": "evidence",
      "source_type": "website_snapshot",
      "description": "Narrative snapshot официального сайта."
    },
    {
      "path": "samples/real_corpus/cases/college_delta_structured_registry/documents/organization_profile.json",
      "category": "other",
      "source_type": "organization_profile",
      "description": "Профиль организации для structured-кейса."
    },
    {
      "path": "samples/real_corpus/cases/college_delta_structured_registry/documents/registry_metrics.csv",
      "category": "data_table",
      "source_type": "registry_export",
      "description": "Structured export с программами, кадрами и публикациями."
    }
  ],
  "annotations": {
    "benchmark_path": "samples/real_corpus/cases/college_delta_structured_registry/annotations/quality_benchmark.json",
    "review_notes_path": "samples/real_corpus/cases/college_delta_structured_registry/annotations/review-notes.md"
  }
}
