{
  "case_id": "college_epsilon_graduate_registry",
  "scenario": "Рособрнадзор + колледж + graduate registry package",
  "regulator": "Рособрнадзор",
  "organization_type": "educational",
  "report_type": "readiness_report",
  "status": "benchmark_ready",
  "redaction_level": "redacted_real_like",
  "difficulty": "high",
  "tags": ["pilot", "graduates", "registry", "mixed-gap"],
  "analysis_focus": ["graduates_category", "mixed_positive_gap", "section_coverage"],
  "quality_targets": {
    "requirement_f1_min": 0.95,
    "status_accuracy_min": 0.70,
    "evidence_f1_min": 0.50,
    "section_coverage_min": 0.80
  },
  "documents": [
    {
      "path": "samples/real_corpus/cases/college_epsilon_graduate_registry/documents/normative_graduate_excerpt.txt",
      "category": "normative",
      "source_type": "regulatory_excerpt",
      "description": "Нормативный фрагмент с выпускниками, сайтовыми публикациями и license-gap."
    },
    {
      "path": "samples/real_corpus/cases/college_epsilon_graduate_registry/documents/site_graduate_snapshot.txt",
      "category": "evidence",
      "source_type": "website_snapshot",
      "description": "Snapshot сайта с программами и локальными актами."
    },
    {
      "path": "samples/real_corpus/cases/college_epsilon_graduate_registry/documents/organization_profile.json",
      "category": "other",
      "source_type": "organization_profile",
      "description": "Профиль организации для graduate-focused кейса."
    },
    {
      "path": "samples/real_corpus/cases/college_epsilon_graduate_registry/documents/graduate_registry.csv",
      "category": "data_table",
      "source_type": "graduate_export",
      "description": "Structured export по выпускникам и трудоустройству."
    }
  ],
  "annotations": {
    "benchmark_path": "samples/real_corpus/cases/college_epsilon_graduate_registry/annotations/quality_benchmark.json",
    "review_notes_path": "samples/real_corpus/cases/college_epsilon_graduate_registry/annotations/review-notes.md"
  }
}
